{
  "previous_regime": "partial_intraday",
  "previous_short_state": null,
  "previous_pivot": 340,
  "previous_gamma_flip": null,
  "previous_call_wall": 360,
  "previous_put_wall": 300,
  "previous_iv_state": {
    "front_atm_iv": 92.88787841796875,
    "realized_vol": 51.347598519526485
  },
  "previous_flow_state": {
    "coverage": "latest_100_consolidated_rows",
    "rows": 32
  },
  "previous_invalidation": null
}
